Title,Authors,Publication Year,Summary,Topics,DOI
"The use of the anaesthetic, enflurane, for determination of metabolic rates and respiratory parameters in insects, using the ant, Camponotus maculatus (Fabricius) as the model","Duncan, Frances D.; Newton, Ryan D.",2000,"This study investigated the effects of the anaesthetic, enflurane, on metabolic rates and ventilation patterns in the spotted sugar ant, Camponotus maculatus, using flow-through respirometry. The standard metabolic rate was not affected by the anaesthetic. While the ants were anaesthetised they exhibited a similar discontinuous gas exchange cycle to that observed when they were voluntarily motionless, but their spiracles remained open for a longer time during the open or burst phase even though the amount of CO2 emitted during this phase remained constant. We discuss this finding in the context of the central nervous system control of the spiracle muscle. For both the determination of standard metabolic rate and ventilation patterns the individual ant has to be motionless. From this study we recommend the use of enflurane to ensure immobility in ants, and other small active insects, during the determination of standard metabolic rates, but the anaesthetic cannot be used to quantify the respiration pattern.","Article Type - Empirical Primary,General Anesthetics",https://www.sciencedirect.com/science/article/pii/S0022191000000767
"Do insects feel pain? A question at the intersection of animal behaviour, philosophy and robotics","Adamo, S.",2016,"Insects are common model organisms for studies in animal behaviour, genetics, molecular biology and other fields. They are also the focus of pesticide research, a subspecialty devoted to devising chemicals capable of killing them. These studies would raise animal welfare concerns, if insects were thought capable of suffering (i.e. experiencing pain). Four disparate areas of research touch on the question of whether insects feel pain: (1) philosophy, (2) insect neurobiology and behaviour, (3) artificial intelligence and robotics and (4) evolution. Using the perspectives provided by these fields, I assess what we know about whether insects feel pain.","Article Type - Perspective,Behavior,Nociception,Pain,Precautionary Principle,Sentience",https://www.sciencedirect.com/science/article/pii/S0003347216300513
Theraphosid medicine: what to do when something is peculiar with the tarantula,"Kennedy, Benjamin",2023,"Background: With over 1060 species reported and a considerable number of these kept in captivity, theraphosid spiders, also known as tarantulas, have become a significant part of private and zoological collections, hence necessitating a greater demand for veterinary expertise. Aim of the article: This comprehensive review addresses the unique challenges in tarantula care. It delves into the application of diagnostic tools like histology, radiography, haematology and microbiology in tarantulas, and discusses how to gather clinically relevant data for effective treatment planning of common conditions. It also outlines adaptations to cater treatments to tarantulas' unique anatomy, and offers guidance on drug selection and veterinary procedures, as well as covering humane euthanasia methods.","Arachnid,Article Type - Review,Chelicerates,Invertebrate,Killing Method,Welfare",https://onlinelibrary.wiley.com/doi/abs/10.1002/inpr.371
Aquatic and Terrestrial Invertebrate Welfare,"Lewbart, Gregory A.; Zachariah, Trevor T.",2023,"Invertebrates are a diverse group of animals that make up the majority of the animal kingdom and encompass a wide array of species with varying adaptations and characteristics. Invertebrates are found in nearly all of the world’s habitats, including aquatic, marine, and terrestrial environments. There are many misconceptions about invertebrate sentience, welfare requirements, the need for environmental enrichment, and overall care and husbandry for this amazing group of animals. This review addresses these topics and more for a select group of invertebrates with biomedical, economical, display, and human companionship importance.","Aquatic,Article Type - Review,Chelicerates,Crustacean,Echinoderm,Insects,Invertebrate,Mollusc,Welfare",https://www.mdpi.com/2076-2615/13/21/3375
MULTIPLE COMPARISONS IN BIOMEDICAL RESEARCH: THE PROBLEM AND ITS SOLUTIONS,"Narkevich, A. N.; Николаевич, Наркевич Артём; Vinogradov, K. A.; Анатольевич, Виноградов Константин; Grjibovski, A. M.; Мечиславович, Гржибовский Андрей",2020,"One of the most common but rarely discussed problems in Russian biomedical research is a problem of multiple comparisons. When a researcher performs pairwise comparisons of means in several groups the number of tested ststistical hypotheses increases leading to inflation of the alpha-error. In international scientific literature this issue is well-described and several solutions are offered. The aim of this article is to describe the problem of alpha error inflation and present methods for solving the problem of multiple comparisons. The methods suggested in this paper can be applied at the stages of research planning, data analysis and interpretation of the results. Bonferroni, Sidak, Holm-Bonferroni, Holm-Sidak and the Benjamin-Hochberg methods are described in details. We also present user-friendly examples for manual calculations as well as a description of implementation of the suggested solutions using SPSS software.",,https://doi.org/10.33396/1728-0869-2020-10-55-64
A Simple Sequentially Rejective Multiple Test Procedure,"Holm, Sture",1979,"This paper presents a simple and widely applicable multiple test procedure of the sequentially rejective type, i.e. hypotheses are rejected one at a time until no further rejections can be done. It is shown that the test has a prescribed level of significance protection against error of the first kind for any combination of true hypotheses. The power properties of the test and a number of possible applications are also discussed.",,https://www.jstor.org/stable/4615733
"Assessing the Welfare of Captive Group-Housed Cockroaches, Gromphadorhina oblongonota","Free, Danielle; Wolfensohn, Sarah",2023,"The welfare of invertebrates under human care is of growing concern, particularly with the increasing interest in insect farming as an environmentally sustainable means of producing food. Additionally, individual welfare monitoring systems can be time-consuming and impractical for larger groups, particularly when individual animals are difficult to identify. It is, therefore, imperative to develop a validated system for monitoring terrestrial invertebrate welfare at a group level. The Animal Welfare Assessment Grid (AWAG) is an objective welfare-monitoring tool that has been approved for use with a wide range of species. This study modified the AWAG for large group-level welfare assessments and successfully trialled it on a terrestrial invertebrate species, a group of captive male Gromphadorhina oblongonota. The modified template evaluated the group’s welfare by scoring changes to 12 factors that could be tracked over time. The results highlight that the welfare of G. oblongonota is likely to be influenced by environmental and social factors, and inform practical improvements in G. oblongonota care that will result in improved welfare. The findings also demonstrate an efficient way to assess the welfare of invertebrates at the group level, and given the recent UK legislation (Animal Welfare (Sentience) Bill, 2022) plus the emerging interest in invertebrate farming, our findings hold timely significance.","Article Type - Empirical Primary,Cockroach,Farming,Insect farming,Insects,Welfare",https://www.mdpi.com/2076-2615/13/21/3351
Animal welfare science: an integral piece of sustainable insect agriculture,"Barrett, M.; Adcock, S. J. J.",2023,"Abstract The insects as food and feed (IAFF) industry represents one of the largest undertakings of industrial livestock rearing in human history, with at least a trillion animals reared each year and massive growth potential. As other livestock industries have grown, animal welfare science has become an essential field for maintaining socially responsible, ethical, and sustainable industry practice. Like traditional livestock industries, the IAFF industry could also benefit – ethically, socially, and economically – from a field of welfare science. Here, we present three economic reasons for considering animal welfare in intensive production systems: (1) improving production outcomes, (2) maintaining social license to operate, and (3) differentiating products. In each case, we provide examples from established livestock industries that highlight how the field of animal welfare science can benefit producers. Further, we provide examples of how the IAFF industry would benefit from the support of a dedicated field of welfare science. We end by calling attention to key partnerships between entomologists, welfare scientists, and producers that could advance the common goals of these stakeholder groups, as well as animal welfare in insect agriculture.","Black Soldier Fly,Farming,Fly,Insects,Policy,Welfare",https://brill.com/view/journals/jiff/aop/article-10.1163-23524588-20230126/article-10.1163-23524588-20230126.xml
Assessing Negative Welfare Measures for Wild Invertebrates: The Case for Octopuses,"Andrade, Michaella P.; Santos, Charles Morphy D.; De Paiva, Mizziara M. M.; Medeiros, Sylvia L. S.; O’Brien, C. E.; Lima, Françoise D.; Machado, Janaina F.; Leite, Tatiana S.",2023,"Welfare metrics have been established for octopuses in the laboratory, but not for octopuses living in the wild. Wild octopuses are constantly exposed to potentially harmful situations, and the ability to assess the welfare status of wild octopuses could provide pertinent information about individuals’ health and species’ resilience to stressors. Here, we used underwater photos and videos to identify injuries and stress-related behaviors in wild Octopus insularis in a variety of contexts, including interacting with fishermen, interacting with other octopuses and fish, proximity to predators, in den, foraging, and in senescence. We adapted established metrics of octopus welfare from the laboratory to these wild octopuses. In addition to observing all of the stress measures, we also identified two previously unknown measures associated with decreased welfare: (1) a half white eye flash and (2) a half-and-half blotch body pattern. More than half of the individuals analyzed had arm loss, and almost half of the individuals had skin injuries. We also observed that irregular chromatophore expression and abnormal motor coordination were associated with interactions with fishermen. This is the first study to apply measures of welfare from the laboratory to wild octopuses. Our results may also aid in the identification of welfare measures for other wild invertebrates.","Article Type - Empirical Primary,Cephalopod,Invertebrate,Moral Status,Welfare,Wild Animals",https://www.mdpi.com/2076-2615/13/19/3021
Can We Use the Study of Introspection to Assess Decision-Making and Understand Consciousness in Cephalopods? A Reply to Kammerer and Frankish,"Mather, Jennifer; Andrade, Michaella P.",2023,"Kammerer and Frankish (this issue) suggest we evaluate introspection of mental states to examine consciousness, but in cephalopods we can only judge internal actions by behaviour output. We can look for mental states — perceptions, beliefs, and intentions — where the tight input–action linkage that is true for reflexes, instincts, and well-learned actions is discontinuous. Here the animal is internally evaluating the sensory input from previous information and making a decision before acting. Perceptions: the octopus motion parallax head bob and wound tending. Beliefs: the cuttlefish delay of gratification. Intentions: use of previous information for future strategies in octopus win-switch foraging and carrying a coconut for future shelter. Intentions are also used in skin displays, their widespread directional lateralization, the octopus 'passing cloud' to startle an immobile prey, the cuttlefish eyespot dot production to repel only visual predators, and the cuttlefish males' deceptive use of the female skin display. These examples allow us to assume in what situations introspection might be used but tell us little about the process of these actions. However, the quantitative variation, laterality, and combination of different displays suggest that cephalopod sexual skin displays are a special case of linkage of internal evaluation to external output that needs further behavioural and neurophysiological assessment.","Affective States,Article Type - Opinion,Cephalopod,Invertebrate",
Descending GABAergic pathway links brain sugar-sensing to peripheral nociceptive gating in Drosophila,"Nakamizo-Dojo, Mami; Ishii, Kenichi; Yoshino, Jiro; Tsuji, Masato; Emoto, Kazuo",2023,"Although painful stimuli elicit defensive responses including escape behavior for survival, starved animals often prioritize feeding over escape even in a noxious environment. This behavioral priority is typically mediated by suppression of noxious inputs through descending control in the brain, yet underlying molecular and cellular mechanisms are incompletely understood. Here we identify a cluster of GABAergic neurons in Drosophila larval brain, designated as SEZ-localized Descending GABAergic neurons (SDGs), that project descending axons onto the axon terminals of the peripheral nociceptive neurons and prevent presynaptic activity through GABAB receptors. Remarkably, glucose feeding to starved larvae causes sustained activation of SDGs through glucose-sensing neurons and subsequent insulin signaling in SDGs, which attenuates nociception and thereby suppresses escape behavior in response to multiple noxious stimuli. These findings illustrate a neural mechanism by which sugar sensing neurons in the brain engages descending GABAergic neurons in nociceptive gating to achieve hierarchical interaction between feeding and escape behavior.","Article Type - Empirical Primary,Fly,Fruit Fly,Insects,Pain",https://www.nature.com/articles/s41467-023-42202-9
Descending control of nociception in insects?,"Gibbons, Matilda; Sarlak, Sajedeh; Chittka, Lars",2022,"Modulation of nociception allows animals to optimize chances of survival by adapting their behaviour in different contexts. In mammals, this is executed by neurons from the brain and is referred to as the descending control of nociception. Whether insects have such control, or the neural circuits allowing it, has rarely been explored. Based on behavioural, neuroscientific and molecular evidence, we argue that insects probably have descending controls for nociception. Behavioural work shows that insects can modulate nocifensive behaviour. Such modulation is at least in part controlled by the central nervous system since the information mediating such prioritization is processed by the brain. Central nervous system control of nociception is further supported by neuroanatomical and neurobiological evidence showing that the insect brain can facilitate or suppress nocifensive behaviour, and by molecular studies revealing pathways involved in the inhibition of nocifensive behaviour both peripherally and centrally. Insects lack the endogenous opioid peptides and their receptors that contribute to mammalian descending nociception controls, so we discuss likely alternative molecular mechanisms for the insect descending nociception controls. We discuss what the existence of descending control of nociception in insects may reveal about pain perception in insects and finally consider the ethical implications of these novel findings.","Article Type - Review,Behavior,Nociception,Pain",https://royalsocietypublishing.org/doi/full/10.1098/rspb.2022.0599
"Ethics and Care: For Animals, Not Just Mammals","Mather, Jennifer A.",2019,"In the last few decades, we have made great strides in recognizing ethics and providing care for animals, but the focus has been mainly on mammals. This stems from a bias of attention not only in research but predominantly in non-scientists’ attention (to ‘popular’ animals), resulting partly from discussion about and depiction of animals in publications addressed to the public. This is somewhat due to political pressure, and can result in uneven conservation efforts and biases in targets for welfare concerns. As a result, there has been a huge backlash again, with concerns about pain sensitivity and welfare in fish, and a less focused but more pervasive omission of consideration of all invertebrates. That means welfare efforts are focused on 0.2% of the animal species on the planet, and education about non-mammals, particularly addressed to children, is necessary to broaden this focus and care more fully for the inhabitants of the planet.","Article Type - Perspective,Crustacean,Ethics,Moral Status,Welfare",https://www.mdpi.com/2076-2615/9/12/1018
Neuroscience Needs Behavior: Correcting a Reductionist Bias,"Krakauer, John W.; Ghazanfar, Asif A.; Gomez-Marin, Alex; MacIver, Malcolm A.; Poeppel, David",2017,,,https://www.cell.com/neuron/abstract/S0896-6273(16)31040-6
Bridging the empathy gap for invertebrates,"Marzluff, John",2020,,"Article Type - Commentary,Empathy Gap,Invertebrate,Moral Status,Sentience",https://www.wellbeingintlstudiesrepository.org/animsent/vol5/iss29/22
Invertebrate welfare in the wild,"Soryl, Asher",2020,,"Article Type - Commentary,Invertebrate,Moral Status,Precautionary Principle,Welfare,Wild Animals",https://www.wellbeingintlstudiesrepository.org/animsent/vol5/iss29/7
Emergency Care of Invertebrates,"Cooper, John E.",1998,"Invertebrates are of increasing importance to the veterinary profession, but little scientifically-based information exists on their emergency care. Therefore, basic principles—supportive care, including administration of fluids, and specific therapy (where available)—must be followed up on. Knowledge and understanding of the biology and natural history of these animals are essential if critical care is to prove successful.","Anesthesia,Article Type - Review,Invertebrate,Local Anesthetic,Welfare",https://www.sciencedirect.com/science/article/pii/S1094919417301640
"Review: Sentientism – for whose sake? Ethics, sciences, and crypto-teleological fact-value bridges, illustrated by the research about sentience in invertebrates","Baranzke, H.; Ingensiep, H. W.",2023,"Sentientism is the most influential position in animal ethics. It presents sentience as decisive for integrating animals in ethics. Nevertheless, its significance for animal ethical argumentation is not quite clear. Does it mean (a) that sentience is a valuable state, which awards sentient individuals the moral prize of something like ‘intrinsic value’? (b) Or is sentience an empirical fact that informs how animal welfare can be adequately realised in samples of certain species? (c) Or does sentience explain psychologically why humans identify emotionally with singular animals? Additionally, the questions show how different animals are addressed, namely (a) as individual units of sentience (individuality), (b) as representatives of certain species (exemplarity), and (c) as unique relata in distinguished human-animal relationships (singularity). Every suggestion of the use of sentientism faces specific challenges: (a) Sentience used as a foundational value premise is philosophically confronted with the fact-value-fallacy. Taken as an absolute value, sentientism may even threaten the status of the sentient individual for the sake of the ideological status of a world without suffering. (b) Sentience in the animal ethical welfare application perspective asks for an evidence-based (neuro-)biopsychological terminology to operationalise the boundary of sentience in animal welfare research, and is confronted with the other-minds problem. For the sake of the individual animal, it has to refer to the specific characteristics of its species. (c) Human-animal relationships have to face the risk of emotional abuse and sentimental anthropomorphism. We must therefore carefully examine the question: For whose sake are not only companion animals regarded as unique – for the sake of the animal or for the sake of human emotional needs? – The range of challenges signals a loss of comprehensive value orientation in modern times. In view of a deeper understanding of the value crisis, the paper starts with a historical reconstruction of the philosophical implications of the transition from natural teleology to modern science. Initially, the ancient conceptual origin of sentientism – the anima sensitiva and its position in a natural philosophical teleological order – reveals sentientism as an isolated fragment from the broken Aristotelean scala naturae. Understanding Aristotle’s highly influential natural teleological metaphysics and its destruction by the rise of modern science can explain how a common crypto-teleological language generates argumentation patterns that are problematic today. A consideration of Kant’s epistemological critique of natural teleology, and his inclusion of animals as sentient beings in a self-reflective modern ethics, may help to clarify the roles of ethics, (bio)sciences, and teleology in enlightened animal ethical argumentations concerning sentience and animal welfare.","Article Type - Review,Ethics,Invertebrate,Moral Status,Sentience,Welfare",https://www.sciencedirect.com/science/article/pii/S1751731123001726
Invertebrate pain and suffering: What do analgesic studies tell us?,"Chan, Timothy",,"Disclaimer: • ·         While this essay discusses methods and results of non-human animal experiments, I do not necessarily support non-human animal…","Anaesthetic,Analgesic,Article Type - Blog Post,Insects,Invertebrate,Welfare",https://forum.effectivealtruism.org/posts/oeJG6MaRXjeCJwjFH/invertebrate-pain-and-suffering-what-do-analgesic-studies
Towards welfare biology: Evolutionary economics of animal consciousness and suffering,"Ng, Yew-Kwang",1995,"Welfare biology is the study of living things and their environment with respect to their welfare (defined as net happiness, or enjoyment minus suffering). Despite difficulties of ascertaining and measuring welfare and relevancy to normative issues, welfare biology is a positive science. Evolutionary economics and population dynamics are used to help answer basic questions in welfare biology: Which species are affective sentients capable of welfare? Do they enjoy positive or negative welfare? Can their welfare be dramatically increased? Under plausible axioms, all conscious species are plastic and all plastic species are conscious (and, with a stronger axiom, capable of welfare). More complex niches favour the evolution of more rational species. Evolutionary economics also supports the common-sense view that individual sentients failing to survive to mate suffer negative welfare. A kind of God-made (or evolution-created) fairness between species is also unexpectedly found. The contrast between growth maximization (as may be favoured by natural selection), average welfare, and total welfare maximization is discussed. It is shown that welfare could be increased without even sacrificing numbers (at equilibrium). Since the long-term reduction in animal suffering depends on scientific advances, strict restrictions on animal experimentation may be counter-productive to animal welfare.","Article Type - Theoretical Primary,Invertebrate,Moral Status,Sentience,Welfare",https://doi.org/10.1007/BF00852469
