Title,Authors,Publication Year,Summary,Topics,DOI
"Entomophagy: What, If Anything, Do We Owe to Insects?","Martin, Angela K.",,,"Article Type - Book Chapter,Farming,Food/feed,Moral Status,Sentience",
Sentience in decapod crustaceans:  A general framework and review of the evidence,"Crump, Andrew; Browning, Heather; Schnell, Alex; Burn, Charlotte; Birch, Jonathan",2022,,"Article Type - Review,Cephalopod,Decapod,Pain,Sentience",https://www.wellbeingintlstudiesrepository.org/animsent/vol7/iss32/1
Inhibition of pain or response to injury in invertebrates and vertebrates,"Gibbons, Matilda; Sarlak, Sajedeh",2020,,"Article Type - Commentary,Invertebrate,Modulation,Pain,Sentience",https://www.wellbeingintlstudiesrepository.org/animsent/vol5/iss29/34
Insect Pain and Suffering by Humans: An Argument for Misanthropic Anti-natalism,"Smith, Oliver D.",2022,"Misanthropic anti-natalism argues it is unethical for humans to procreate because the human species inflicts an immense amount of pain and suffering (including painful death) on other humans, non-human animals and causes environmental degradation (such as pollution). This article tentatively estimates the number of insect deaths caused by humans worldwide each year is 10 quadrillion and argues since the vast majority of these deaths are painful, humans should refrain voluntarily from procreation and bringing new humans into existence.","Article Type - Theoretical Primary,Killing Method,Pain",https://hcommons.org/deposits/item/hc:47749/
Subjective experience in insects:  Definitions and other difficulties,"Adamo, Shelley",2016,,"Affective States,Article Type - Commentary,Sentience",https://www.wellbeingintlstudiesrepository.org/animsent/vol1/iss9/15
Insects: Still looking like zombies,"Hill, Christopher",2016,,"Affective States,Article Type - Commentary,Sentience",https://www.wellbeingintlstudiesrepository.org/animsent/vol1/iss9/20
Fish sentience: A hypothesis worth pursuing,"Burgos, José",2017,,"Article Type - Commentary,Fish,Sentience",https://www.wellbeingintlstudiesrepository.org/animsent/vol2/iss13/12
Extending the null hypothesis to invertebrate pain sentience,"Kakrada, Eva; Colombo, Michael",2022,,"Affective States,Article Type - Commentary,Invertebrate,Sentience",https://www.wellbeingintlstudiesrepository.org/animsent/vol7/iss32/25
It might not matter very much whether insects are conscious,"Levy, Neil",2020,,"Affective States,Article Type - Commentary,Sentience",https://www.wellbeingintlstudiesrepository.org/animsent/vol5/iss29/2
Cephalopods are best candidates for invertebrate consciousness,"Mather, Jennifer A.; Carere, Claudio",2016,"Insects might have been the first invertebrates to evolve sentience, but cephalopods were the first invertebrates to gain scientific recognition for it.","Article Type - Commentary,Cephalopod,Research Use,Sentience,Welfare",https://www.wellbeingintlstudiesrepository.org/animsent/vol1/iss9/2
Sentience in all organisms with centralized nervous systems,"Marino, Lori",2020,,"Article Type - Commentary,Sentience",https://www.wellbeingintlstudiesrepository.org/animsent/vol5/iss29/19
Insect consciousness: Fine-tuning the hypothesis,"Mallatt, Jon; Feinberg, Todd",2016,,"Article Type - Commentary,Sentience",https://www.wellbeingintlstudiesrepository.org/animsent/vol1/iss9/10
On the possibility of invertebrate sentience,"DeGrazia, David",2020,,"Article Type - Commentary,Moral Status,Pain,Sentience",https://www.wellbeingintlstudiesrepository.org/animsent/vol5/iss29/15
Welfare of farmed insects,"van Huis, A.",2019,"When discussing insect welfare, the distinction is often made between nociception and pain, the first being a reflex response, while the second refers to a negative emotion perceived by the brain. There is some evidence that insects can experience emotions. Anthropomorphism may influence opinions on the question of how smart animals are. For insects, the precautionary principle is often used: give insects the benefit of the doubt and regard them as ‘sentient beings’. Considering the large number of farmed insects needed for food or feed, some articles discourage the consumption of insects, and favour plant-based diets. However, the protection of food plants also involves the killing of huge numbers of insects. I conclude that in insect farming we need to treat insects as sentient beings.","Article Type - Opinion,Behavior,Farming,Food/feed,Moral Status,Pain,Sentience,Welfare",https://www.wageningenacademic.com/doi/abs/10.3920/JIFF2019.x004
Eating insects and tourism: Ethical challenges in a changing world,"Perdue, Robert Todd",2018,"This chapter outlines the relationship between entomophagy and tourism. It examines ethical challenges that can result from tourism exchanges that exploit. The chapter focuses on the ethics of eating insects and current debates about insect sentience. Entomophagy, the eating of insects, rarely comes up in the tourism literature, or any literature for that matter – unless, that is, you are a reader of the Journal of Insects as Food and Feed, whose sheer existence hints at the growing importance that entomophagy may hold for people rapidly changing world. In countries without such a legacy, interest has also increased. The United States has seen curiosity in bugs as a food source increase dramatically if the number of annual insect festivals held there is any indication. A major question related to entomophagy and tourism, and to tourism generally, is its exploitative potential.","Article Type - Book Chapter,Farming,Food/feed",
Considering animals’ feelings: Précis of <em>Sentience and animal welfare</em> (Broom 2014),"Broom, Donald",2016,,"Article Type - Opinion,Fish,Invertebrate,Killing Method,Moral Status,Sentience,Welfare",https://www.wellbeingintlstudiesrepository.org/animsent/vol1/iss5/1
Insects have agency but probably not sentience because they lack social bonding,"van Hateren, J.",2016,,"Affective States,Article Type - Commentary,Sentience",https://www.wellbeingintlstudiesrepository.org/animsent/vol1/iss9/3
Insects have the capacity for subjective experience,"Klein, Colin; Barron, Andrew",2016,,"Article Type - Review,Sentience",https://www.wellbeingintlstudiesrepository.org/animsent/vol1/iss9/1
Affective sentience and moral protection,"Powell, Russell; Mikhalevich, Irina",2021,,"Affective States,Article Type - Commentary,Moral Status,Sentience",https://scholarworks.rit.edu/article/1994
"Insect consciousness: Commitments, conflicts and consequences","Klein, Colin; Barron, Andrew",2016,,"Affective States,Article Type - Commentary,Sentience",https://www.wellbeingintlstudiesrepository.org/animsent/vol1/iss9/21
Insects join the consciousness fray,"Merker, Bjorn",2016,,"Article Type - Commentary,Sentience",https://www.wellbeingintlstudiesrepository.org/animsent/vol1/iss9/4
"Brain complexity, sentience and welfare","Broom, Donald",2020,,"Article Type - Opinion,Invertebrate,Moral Status,Welfare",https://www.wellbeingintlstudiesrepository.org/animsent/vol5/iss29/27
Perspective: Opportunities for advancing aquatic invertebrate welfare,"Wahltinez, Sarah J.; Stacy, Nicole I.; Hadfield, Catherine A.; Harms, Craig A.; Lewbart, Gregory A.; Newton, Alisa L.; Nunamaker, Elizabeth A.",2022,"Welfare considerations and regulations for invertebrates have lagged behind those for vertebrates, despite invertebrates comprising more than 95% of earth's species. Humans interact with and use aquatic invertebrates for exhibition in zoos and aquaria, as pets, research subjects, and important food sources. Recent research has indicated that aquatic invertebrates, in particular cephalopod mollusks and decapod crustaceans, experience stress and may be able to feel pain. With this article, we present results of a survey on attitudes of aquatic animal health professionals toward aquatic invertebrate welfare and provide practical recommendations for advancing aquatic invertebrate welfare across four areas of opportunity: use of anesthesia, analgesia, and euthanasia; development of less invasive diagnostic and research sampling methods based on 3R principles; use of humane slaughter methods for aquatic invertebrates; and reducing impacts of invasive procedures in aquaculture and fisheries. We encourage consideration of these opportunities to achieve far-reaching improvements in aquatic invertebrate welfare.","Article Type - Perspective,Cephalopod,Decapod,Invertebrate,Killing Method,Welfare",https://www.frontiersin.org/articles/10.3389/fvets.2022.973376
Welfare Assessment of Invertebrates: Adapting the Animal Welfare Assessment Grid (AWAG) for Zoo Decapods and Cephalopods,"Narshi, Tanya M.; Free, Danielle; Justice, William S. M.; Smith, Sarah Jayne; Wolfensohn, Sarah",2022,"Consumer demand for invertebrates is on the rise as their numbers in the wild dwindle. However, with the growing conservation efforts of modern zoos and aquariums, and evidence from over 300 studies showing that invertebrates are capable of sentience, public interest, and moral concern for welfare of invertebrates have increased. The challenge for zoos and aquariums is in developing an objective and repeatable method for evaluating welfare that can be applied to invertebrates in zoological collections. Recently introduced into zoological collection management is the Animal Welfare Assessment Grid (AWAG). The AWAG helps to identify negative and positive welfare states, through assessing animal- and environmental-based indicators to make changes that lead to a better quality of life. Originally developed for the assessment of laboratory primates, the system has been successfully adapted to assess a variety of taxa across different environments, facilitated by the development of cloud-based software. In this study, the AWAG has been adapted to assess the cumulative lifetime experience of captive decapods and cephalopods at two different institutions, Marwell Zoo and National Marine Aquarium. This study has provided further evidence that the AWAG is adaptable and demonstrates the first time any objective scoring system has been successfully adapted for use in invertebrates. Through graphical representation, the results show that the AWAG identifies changes in welfare scores that can be attributed to specific events and can be used to predict the future vulnerability of species to welfare changes and suggest alternative management methods. This monitoring tool provides a versatile method of implementing practical welfare monitoring in zoos and aquariums.","Article Type - Empirical Primary,Cephalopod,Decapod,Invertebrate,Welfare",https://www.mdpi.com/2076-2615/12/13/1675
Judgement bias may be explained by shifts in stimulus response curves,"Strang, Caroline; Muth, Felicity",2023,,"Affective States,Article Type - Empirical Primary,Bee,Judgment Bias,Sentience",
Farmed Yellow Mealworm (Tenebrio molitor; Coleoptera: Tenebrionidae) Welfare: Species-Specific Recommendations for a Global Industry,"Barrett, Meghan; Godfrey, Rebekah Keating; Schnell, Alexandra; Fischer, Bob",2023,"Yellow mealworms (Tenebrio molitor; Coleoptera: Tenebrionidae) are currently the most farmed holometabolous insect species in the insects as food and feed industry, with over 300 billion individual mealworms reared annually. Yellow mealworm larvae are being developed for potential uses as human protein, pet, livestock and fish feed, reclamation of mycotoxin-contaminated grains, and more. Insect welfare is of great interest to consumers, producers, and academics; yet no studies have considered the species-specific welfare concerns of farmed yellow mealworms under current industry conditions. Following a model for considering farmed insect welfare, we explore factors related to yellow mealworm welfare in commercial rearing facilities, including: interspecific interactions (including predators, parasites, and pathogens), abiotic conditions (temperature, hydration, atmospheric gasses, lighting), nutrition (including pollutants and hormones), intraspecific concerns (genetics, morphological defects, cannibalism, density, mating and oviposition needs, and handling-associated stress), and slaughter and depopulation methods (including anesthesia). We discuss the current major and minor welfare concerns in the industry and future concerns that may appear as the industry continues to grow. We make recommendations for improving mealworm welfare and discuss future research directions that are necessary to better understand the welfare of this species.","Article Type - Review,Beetle,Farming,Juvenile,Killing Method,Rearing",https://osf.io/e92kw/
To Regulate or Not to Regulate? The Future of Animal Ethics in Experimental Research with Insects,"Freelance, Christopher B.",2019,"Regulatory ethical frameworks governing animal experimentation are a hallmark of modern biology. While most countries have ethical standards regarding the use of animals for scientific purposes, experiments involving insects are not included in these standards. With studies in recent years suggesting that insects may possess faculties akin to emotive states, there is growing discussion surrounding the ethical implications of scientific experimentation involving insects. This paper explores some of the current evidence for the ability of insects to experience emotive states and highlights how current formal animal experimentation ethics frameworks are unnecessary for governing the use of insects for scientific purposes. At its conclusion, this paper discusses ways in which scientists can, and should, uniformly maximise the welfare of insects used in their experiments in a way that is of benefit to their science as well as to the dignity and welfare of their study organisms.","Article Type - Opinion,Moral Status,Welfare",https://doi.org/10.1007/s11948-018-0066-9
Evaluation of Targeted Injections of Ivermectin or Potassium Chloride for Euthanasia of Anesthetized Thorny Devil Stick Insects (Eurycantha calcarata),"Heniff, Ashlyn C.; Gorges, Melinda A.; Lewbart, Gregory A.; Balko, Julie A.",2023,"Insects are commonly utilized in biomedical research and have become increasingly popular in museum collections and as pets. Despite this, objective evaluation of insect euthanasia is scarce. This study investigated the effectiveness of targeted injections of ivermectin or potassium chloride (KCl) for the euthanasia of anesthetized thorny devil stick insects (Eurycantha calcarata). Ten clinically healthy mature insects (six males, four females) were enrolled. Insects were weighed and anesthetized via exposure to a cotton ball soaked with 1.6 mL of liquid isoflurane in a 1 L sealed chamber until loss of righting reflex and response to stimulation (induction). Insects then received one of three treatments: ivermectin 100 mg/kg (n = 4), KCl 200 mEq/kg (n = 4), or 0.9% sodium chloride 100 mL/kg (n = 2) injected along the ventral thoracic midline between the first leg plate and the caudal adjacent plate. Following injection, insects were serially monitored for return of spontaneous movement and righting reflex. Death was defined as the absence of spontaneous movement for 48 h. Median (range) induction time and isoflurane concentration at induction was 36 (22–39) min (n = 9) and 22 (19–22)%, respectively. Euthanasia was successful in 4/4, 3/4, and 0/2 isoflurane-anesthetized insects receiving ivermectin, KCl, or 0.9% sodium chloride, respectively. Recovery was prolonged at 10.5 (sodium chloride female), 11.0 (KCl male), and 18.0 (sodium chloride male) hours. This is the first prospective investigation of euthanasia in adult E. calcarata. In this preliminary study, ivermectin 100 mg/kg via ventral midline injection was effective for euthanasia of thorny devil stick insects.","Article Type - Empirical Primary,Killing Method,Phasmid",https://www.mdpi.com/2673-5636/4/1/20
Chapter 26: Anesthesia and analgesia in invertebrates,"Wahltinez, Sarah J.; Harms, Craig A.; Lewbart, Gregory A.",2023,,"Anaesthetic,Analgesic,Article Type - Book Chapter,Killing Method,Pain",
AVMA Guidelines for the Euthanasia of Animals: 2020 Edition,"Leary, Steven; Pharmaceuticals, Fidelis; Underwood, Wendy; Anthony, Raymond; Cartner, Samuel; Johnson, Cia L; Patterson-Kane, Emily",2020,,"Article Type - Protocol,Killing Method",
"Morphine analgesia, tolerance and addiction in the cricket pteronemobius sp. (orthoptera, insecta)","Zabala, Nelson A.; Gómez, Maria A.",1991,"The escape reaction time (ERT) of the cricket Pteronemobius sp. from the heated box begins at 48° and increases with temperature until 56°C, beyond which there is no further increase. The ERT (2.2 ± 1.39 s) from the hot box at 54°C is used as a model for studying the analgesic effects of opiates. Results of the present paper show that the ERT did not change after injecting the insect in the abdominal haemocoel with 0.9% saline solution, but ERT increased when 0.32, 0.52 or 0.69 mg/g of morphine is injected in the same place. The maximum ERT increase is reached at 90 min after drug injection, and the drug effect disappears 3 h after the injection. At 90 min after drug injections, the dose of 0.50 mg/g of morphine produces 50% of ERT increase, and it is referred to as the median analgesic dose (D50). 1.05 mg/g of morphine produces an ERT longer than 30 s that results in an irreversible damage to the insect. Sixty-four μg/g of naloxone given in addition to D50 of morphine fully blocked the effect of morphine during its 3-h action. However, more than 64 μg/g of naloxone alone also increase the ERT in the cricket, similar to what has been described for vertebrates. Four daily morphine injections of D50 decreased ERT in such a way that, at the fourth day, the ERT is similar to the ERT produced by saline solution; i.e., tolerance is shown. The suppression of daily morphine injections of D50 during the fifth day produced a hyperresponse to vibration (big jumps) not shown in the case of the injections of saline solution; i.e., addiction is shown.","Analgesic,Article Type - Empirical Primary,Cricket,Opioid",https://www.sciencedirect.com/science/article/pii/0091305791901028
Doing better for understudied species: Evaluation and improvement of a species-general animal welfare assessment tool for zoos,"O’Brien, Shannon L.; Cronin, Katherine A.",2023,"Accredited zoos and aquariums are required to have a welfare assessment process in place for the animals in their care. However, welfare assessment theoretical frameworks and methodologies vary widely. Previous studies have shown that taxonomic biases in research are found broadly within the field of animal behavior and specifically within applied animal welfare science, which could translate to taxonomic biases in applied welfare assessment tools. After creating and then using a species-general welfare assessment at Lincoln Park Zoo for 2.5 years, we sought to examine whether there were systematic differences in welfare scores for different taxa. There were 939 Welfare Discussion Tools completed for 174 species between July 2019 and – December 2021, including mammals, birds, reptiles, amphibians, fish, and invertebrates. We found that, broadly, no taxonomic group scored higher than mammals on overall welfare scores, input (resource-based) scores, or output (animal-based) scores. Raters also provided fewer incomplete responses (in the form of “not applicable” or “I don’t know” judgments) for mammals than for other taxonomic groups. Integrating these findings with input from welfare scientists, animal caretakers, behavioral husbandry experts and veterinary staff, we modified our original welfare assessment tool to broaden the taxonomic relevance of the tool. Copies of the original tool and the updated/modified tool are included to serve as a model for institutions developing or revising their own welfare assessment tools.","Article Type - Theoretical Primary,Behavior,Captivity,Invertebrate,Welfare",https://www.sciencedirect.com/science/article/pii/S0168159123001375
The evidence for pain in fish: the use of morphine as an analgesic,"Sneddon, Lynne U",2003,"This paper discusses the evidence for pain perception in fish and presents new data on morphine analgesia in fish. Recent anatomical and electrophysiological studies have demonstrated that fish are capable of nociception, the simple detection of a noxious, potentially painful stimulus and the reflex response to this. To prove pain perception, it must be demonstrated that an animal’s behaviour is adversely affected by a potentially painful event and this must not be a reflex response. The present study examined the acute effects of administering a noxious chemical to the lips of rainbow trout (Oncorhynchus mykiss) to assess what changes occurred in behaviour and physiology. There was no difference in swimming activity or use of cover when comparing the noxiously stimulated individuals with the controls. The noxiously treated individuals performed anomalous behaviours where they rocked on either pectoral fin from side to side and they also rubbed their lips into the gravel and against the sides of the tank. Opercular beat rate (gill or ventilation rate) increased almost double fold after the noxious treatment whereas the controls only showed a 30% increase. Administering morphine significantly reduced the pain-related behaviours and opercular beat rate and thus morphine appears to act as an analgesic in the rainbow trout. It is concluded that these pain-related behaviours are not simple reflexes and therefore there is the potential for pain perception in fish.",,https://www.sciencedirect.com/science/article/pii/S0168159103001138
"Hyperglycaemia induced by anaesthesia in the american cockroach, Periplaneta americana L.","Matthews, J. R.; Downer, R. G. H.",1973,"A hyperglycaemic response is elicited in adult males of the american cockroach, Periplaneta americana, within 60 min of anaesthetizing insects using nitrogen, chilling, or diethyl ether. Hyperglycaemia is also produced as a result of handling insects without anaesthesia. Insects which have been anaesthetized with carbon dioxide do not exhibit a marked change in haemolymph sugar concentration.","Article Type - Empirical Primary,Cockroach,Cold,General Anesthetics",https://cdnsciencepub.com/doi/abs/10.1139/z73-056
"Carbon dioxide anaesthesia and succinic dehydrogenase in the corn earworm, Heliothis zea","Edwards, Lawrence J.",1968,"Anaesthetic levels (30 per cent) of carbon dioxide produced 72 per cent inhibition of in vitro gut succinic dehydrogenase of Heliothis zea. At the 15 per cent level of CO2, competitive inhibition of the enzyme is demonstrated.","Article Type - Empirical Primary,Carbon Dioxide,Juvenile,Moth",https://www.sciencedirect.com/science/article/pii/0022191068900413
Effects of Carbon Dioxide Anaesthesia and Crowding on the Susceptibility of Cockroaches to Insecticides,"Edwards, A. J.",1981,"The susceptibility of adult male American cockroaches, Periplaneta americana (L.), to topical applications of the insecticides lindane and methyl parathion was compared under varying conditions. The use of carbon dioxide anaesthesia to facilitate handling during treatment did not significantly affect the insects' susceptibility to the insecticides. However, the susceptibility of the cockroaches to the insecticides, when confined in batches after treatments, was significantly greater than that of cockroaches isolated after treatment. These results indicate that if, as is frequently the case, poisoned insects are not isolated from each other after treatment, the interactions of poisoned individuals may lead to greater mortality than would otherwise occur. ZUSAMMENFASSUNG WIRKUNG VON KOHLENDIOXYD UND CROWDING AUF DIE EMPFINDLICHKEIT VON KÜCHENSCHABEN GEGEN INSEKTIZIDE Die Empfindlichkeit erwachsener männlicher Küchenschaben, Periplaneta americana (L.), gegen topical appliziertes Lindan und Methylparathion wurde unter verschiedenen Bedingungen verglichen Kohlendioxyd, welches als Betäubungsmittel zur Erleichterung der Manipulation der Schaben verwendet wurde, hatte keinen deutlichen Einfluss auf die Insektizidempfindlichkeit. Wurden die Schaben jedoch nach der Behandlung in Gruppen gehalten, so war ihre Empfindlichkeit bedeutend grösser als wenn sie nach der Behandlung isoliert wurden. Dies deutet darauf hin, dass die gegenseitige Beeinflussung vergifteter Tiere, wie sie oft vorkommen kann, die Todesrate erhöht.","Article Type - Empirical Primary,Carbon Dioxide,Cockroach,General Anesthetics,Insecticide",https://onlinelibrary.wiley.com/doi/abs/10.1111/j.1570-7458.1981.tb03077.x
