Title,Authors,Publication Year,Summary,Topics,DOI
Invertebrate welfare: an overlooked issue,"Horvath, Kelsey; Angeletti, Dario; Nascetti, Giuseppe; Carere, Claudio",2013,"While invertebrates make up the majority of animal species, their welfare is overlooked compared to the concern shown to vertebrates. This fact is highlighted by the near absence of regulations in animal research, with the exception of cephalopods in the European Union. This is often justified by assumptions that invertebrates do not experience pain and stress while lacking the capacity for higher order cognitive functions. Recent research suggests that invertebrates may be just as capable as vertebrates in experiencing pain and stress, and some species display comparable cognitive capacities. Another obstacle is the negative view of invertebrates by the public, which often regards them as pests with no individual personalities, gastronomic entities, or individuals for scientific experimentation without rules. Increasingly, studies have revealed that invertebrates possess individual profiles comparable to the personalities found in vertebrates. Given the large economic impact of invertebrates, developing certain attitude changes in invertebrate welfare may be beneficial for producers while providing higher welfare conditions for the animals. While the immense number and type of species makes it difficult to suggest that all invertebrates will benefit from increased welfare, in this review we provide evidence that the topic of invertebrate welfare should be revisited, more thoroughly investigated, and in cases where appropriate, formally instituted.","Article Type - Review,Invertebrate,Policy,Welfare",https://www.scielosp.org/article/aiss/2013.v49n1/9-17/en/
"Insects raised for food and feed — global scale, practices, and policy","Rowe, Abraham",2021,"Currently, 1 trillion to 1.2 trillion insects are raised on farms annually for food and animal feed. There are currently between 79 billion and 94 billion insects alive on farms globally on average on an average day. While it is unclear what welfare reforms might best improve the lives of insects on","Article Type - Blog Post,Farming,Food/feed,Killing Method,Welfare",https://rethinkpriorities.org/publications/insects-raised-for-food-and-feed
What is unconsciousness in a fly or a worm? A review of general anesthesia in different animal models,"Zalucki, Oressia; van Swinderen, Bruno",2016,"All animals are rendered unresponsive by general anesthetics. In humans, this is observed as a succession of endpoints from memory loss to unconsciousness to immobility. Across animals, anesthesia endpoints such as loss of responsiveness or immobility appear to require significantly different drug concentrations. A closer examination in key model organisms such as the mouse, fly, or the worm, uncovers a trend: more complex behaviors, either requiring several sub-behaviors, or multiple neural circuits working together, are more sensitive to volatile general anesthetics. This trend is also evident when measuring neural correlates of general anesthesia. Here, we review this complexity hypothesis in humans and model organisms, and attempt to reconcile these findings with the more recent view that general anesthetics potentiate endogenous sleep pathways in most animals. Finally, we propose a presynaptic mechanism, and thus an explanation for how these drugs might compromise a succession of brain functions of increasing complexity.","Article Type - Review,Fly,Fruit Fly,General Anesthetics",https://www.sciencedirect.com/science/article/pii/S1053810016301714
The remote roots of consciousness in fruit-fly selective attention?,"Swinderen, Bruno van",2005,"A mechanistic study of consciousness need not be confined to human complexity. Other animals also display key behaviors and responses that have long been intimately tied to the measure of consciousness in humans. Among them are some very well-defined and measurable endpoints: selective attention, sleep and general anesthesia. That these three variables associated with changes in consciousness might exist even in a fruit-fly does not necessarily imply that a fly is “conscious”, but it does suggest that some of the problems central to the field of consciousness studies could be investigated in a model organism such as Drosophila melanogaster. Demonstrating suppression of unattended stimuli, which is central to attention studies in humans, is now possible in Drosophila by measuring neural correlates of visual selection. By combining such studies with an eventual understanding of suppression in other arousal states in the fly, such as sleep and general anesthesia, we might be unraveling mechanisms relevant to consciousness as well. BioEssays 27:321–330, 2005. © 2005 Wiley Periodicals, Inc.","Article Type - Review,Fly,Fruit Fly,General Anesthetics",https://onlinelibrary.wiley.com/doi/abs/10.1002/bies.20195
The Receptor Site and Mechanism of Action of Sodium Channel Blocker Insecticides *,"Zhang, Yongqiang; Du, Yuzhe; Jiang, Dingxin; Behnke, Caitlyn; Nomura, Yoshiko; Zhorov, Boris S.; Dong, Ke",2016,"<p>Sodium channels are excellent targets of both natural and synthetic insecticides with high insect selectivity. Indoxacarb, its active metabolite DCJW, and metaflumizone (MFZ) belong to a relatively new class of sodium channel blocker insecticides (SCBIs) with a mode of action distinct from all other sodium channel-targeting insecticides, including pyrethroids. Electroneutral SCBIs preferably bind to and trap sodium channels in the inactivated state, a mechanism similar to that of cationic local anesthetics. Previous studies identified several SCBI-sensing residues that face the inner pore of sodium channels. However, the receptor site of SCBIs, their atomic mechanisms, and the cause of selective toxicity of MFZ remain elusive. Here, we have built a homology model of the open-state cockroach sodium channel BgNa<sub>v</sub>1-1a. Our computations predicted that SCBIs bind in the inner pore, interact with a sodium ion at the focus of P1 helices, and extend their aromatic moiety into the III/IV domain interface (fenestration). Using model-driven mutagenesis and electrophysiology, we identified five new SCBI-sensing residues, including insect-specific residues. Our study proposes the first three-dimensional models of channel-bound SCBIs, sheds light on the molecular basis of MFZ selective toxicity, and suggests that a sodium ion located in the inner pore contributes to the receptor site for electroneutral SCBIs.</p>","Article Type - Empirical Primary,Fly,Fruit Fly,Sodium Channel Blocker",https://www.jbc.org/article/S0021-9258(20)35986-X/abstract
The impact of anaesthetic technique on survival and fertility in Drosophila,"Champion De Crespigny, Fleur E.; Wedell, Nina",2008,"The consequences of ice and carbon dioxide anaesthetics on the survival and reproductive success of Drosophila simulans and Drosophila melanogaster were investigated after observations of high levels of mortality in D. simulans, possibly associated with brief chill coma. The association between brief chill coma and death is confirmed in female D. simulans but there is no mortality in male D. simulans or D. melanogaster of either sex. Mortality is unlikely to be associated with a strain specific cold intolerance because two geographically distinct populations of D. simulans were examined. In addition to the effect of ice anaesthesia, anaesthetizing newly-eclosed male D. simulans with CO2 causes a reduction in fertility, which is evident 9–13 days after anaesthesia. This finding is important given that CO2 anaesthesia is a standard technique used in Drosophila and other insect cultures, and may have important consequences for studies of male fertility and sperm competition.","Article Type - Empirical Primary,Carbon Dioxide,Cold,Fly,Fruit Fly,General Anesthetics",https://onlinelibrary.wiley.com/doi/abs/10.1111/j.1365-3032.2008.00632.x
"The Effects of Eugenol as an Anesthetic for an Insect: Drosophila, Adults, Larval Heart Rate, and Synaptic Transmission","Weineck, Kristin; Stanback, Alexandra; Cooper, Robin L",2019,"The examination of the active ingredient in clove oil, eugenol, as an anesthetic for use on Drosophila melanogaster was performed. Drosophila melanogaster adult flies were anesthetized with a simple flow through apparatus and they recovered to perform behavioral tests without any defects. Larvae did not become completely anesthetized even with longer exposure periods than adults; however, they did show reduced body wall movements and mouth hook movements. Application of 100ppm in physiological saline directly on the larval heart and neuromuscular junction reduced the heart rate and evoked synaptic transmission. No effect on the postsynaptic glutamate receptors was observed. It is likely eugenol blocks ionic sodium and calcium channels directly and can readily be reversed without any long term consequences in function. Thus, eugenol may serve as an alternative to CO2 or cold as an anesthetic.","Article Type - Empirical Primary,Fly,Fruit Fly,General Anesthetics,Juvenile",
[Sensitivity of larvae of Drosophila melanogaster mutant mus(2)201G1 to various analgesics],"Mikheev, V S; Imianitov, E N",1990,"Sensitivity of larvae from mutagen-sensitive mus(2)201G1 mutant of Drosophila melanogaster to analgin, amidopyrine and antipyrine (4-64 mkmol/ml of medium) was studied. Relative frequency of flies homozygous for this mutation after combined development of homozygous and heterozygous flies in the medium with the analgetic was used as a criterion for larval sensitivity. It is shown that sensitivity of homozygotes was significantly higher than that of heterozygotes to all three analgetics. Relative sensitivity of homozygotes increased with the elevation of drugs concentration. The data obtained demonstrate the mutagenicity of the analgetics tested for Drosophila.","Analgesic,Article Type - Empirical Primary,Fly,Fruit Fly,Juvenile",
Peripheral straightjacket (α2δ Ca2+ channel subunit) expression is required for neuropathic sensitization in Drosophila,"Khuong, Thang M.; Hamoudi, Zina; Manion, John; Loo, Lipin; Muralidharan, Arjun; Neely, G. Gregory",2019,"Nerve injury leads to devastating and often untreatable neuropathic pain. While acute noxious sensation (nociception) is a crucial survival mechanism and is conserved across phyla, chronic neuropathic pain is considered a maladaptive response owing to its devastating impact on a patient's quality of life. We have recently shown that a neuropathic pain-like response occurs in adult Drosophila. However, the mechanisms underlying this phenomenon are largely unknown. Previous studies have shown that the α2δ peripheral calcium channel subunit straightjacket (stj) is a conserved factor required for thermal pain perception. We demonstrate here that stj is required in peripheral ppk+ sensory neurons for acute thermal responses and that it mediates nociceptive hypersensitivity in an adult Drosophila model of neuropathic pain-like disease. Given that calcium channels are the main targets of gabapentinoids (pregabalin and gabapentin), we assessed if these drugs can alleviate nociceptive hypersensitivity. Our findings suggest that gabapentinoids may prevent nociceptive hypersensitivity by preserving central inhibition after nerve injury. Together, our data further highlight the similarity of some mechanisms for pain-like conditions across phyla and validates the scientific use of Drosophila neuropathic sensitization models for analgesic drug discovery. This article is part of the Theo Murphy meeting issue ‘Evolution of mechanisms and behaviour important for pain’.","Analgesic,Article Type - Empirical Primary,Calcium Channel,Fly,Fruit Fly,Nociception",https://royalsocietypublishing.org/doi/full/10.1098/rstb.2019.0287
Neural Ensemble Fragmentation in the Anesthetized Drosophila Brain,"Troup, Michael; Tainton-Heap, Lucy A. L.; Swinderen, Bruno van",2023,"General anesthetics cause a profound loss of behavioral responsiveness in all animals. In mammals, general anesthesia is induced in part by the potentiation of endogenous sleep-promoting circuits, although “deep” anesthesia is understood to be more similar to coma (Brown et al., 2011). Surgically relevant concentrations of anesthetics, such as isoflurane and propofol, have been shown to impair neural connectivity across the mammalian brain (Mashour and Hudetz, 2017; Yang et al., 2021), which presents one explanation why animals become largely unresponsive when exposed to these drugs. It remains unclear whether general anesthetics affect brain dynamics similarly in all animal brains, or whether simpler animals, such as insects, even display levels of neural connectivity that could be disrupted by these drugs. Here, we used whole-brain calcium imaging in behaving female Drosophila flies to investigate whether isoflurane anesthesia induction activates sleep-promoting neurons, and then inquired how all other neurons across the fly brain behave under sustained anesthesia. We were able to track the activity of hundreds of neurons simultaneously during waking and anesthetized states, for spontaneous conditions as well as in response to visual and mechanical stimuli. We compared whole-brain dynamics and connectivity under isoflurane exposure to optogenetically induced sleep. Neurons in the Drosophila brain remain active during general anesthesia as well as induced sleep, although flies become behaviorally inert under both treatments. We identified surprisingly dynamic neural correlation patterns in the waking fly brain, suggesting ensemble-like behavior. These become more fragmented and less diverse under anesthesia but remain wake-like during induced sleep. SIGNIFICANCE STATEMENT When humans are rendered immobile and unresponsive by sleep or general anesthetics, their brains do not shut off — they just change how they operate. We tracked the activity of hundreds of neurons simultaneously in the brains of fruit flies that were anesthetized by isoflurane or genetically put to sleep, to investigate whether these behaviorally inert states shared similar brain dynamics. We uncovered dynamic patterns of neural activity in the waking fly brain, with stimulus-responsive neurons constantly changing through time. Wake-like neural dynamics persisted during induced sleep but became more fragmented under isoflurane anesthesia. This suggests that, like larger brains, the fly brain might also display ensemble-like behavior, which becomes degraded rather than silenced under general anesthesia.","Article Type - Empirical Primary,Fly,Fruit Fly,General Anesthetics",https://www.jneurosci.org/content/43/14/2537
Influence of cold and carbon dioxide anaesthesia on the susceptibility of adults of Ceratitis capitata to malathion,"Viñuela, E.",1982,"Insect immobilization by several methods: cold, ether, chloroform, or more recently CO2, is a common practice in toxicological studies to facilitate insect handling (Harris et al., 1965). FAO (1969) recommends the use of both cold and carbon dioxide.","Article Type - Empirical Primary,Carbon Dioxide,Cold,Fly,Fruit Fly,General Anesthetics,Insecticide",https://onlinelibrary.wiley.com/doi/abs/10.1111/j.1570-7458.1982.tb03221.x
Impaired climbing and flight behaviour in Drosophila melanogaster following carbon dioxide anaesthesia,"Bartholomew, Nathan R; Burdett, Jacob M; VandenBrooks, John M; Quinlan, Michael C; Call, Gerald B",2015,"Laboratories that study Drosophila melanogaster or other insects commonly use carbon dioxide (CO2) anaesthesia for sorting or other work. Unfortunately, the use of CO2 has potential unwanted physiological effects, including altered respiratory and muscle physiology, which impact motor function behaviours. The effects of CO2 at different levels and exposure times were examined on the subsequent recovery of motor function as assessed by climbing and flight assays. With as little as a five minute exposure to 100% CO2, D. melanogaster exhibited climbing deficits up to 24 hours after exposure. Any exposure length over five minutes produced climbing deficits that lasted for days. Flight behaviour was also impaired following CO2 exposure. Overall, there was a positive correlation between CO2 exposure length and recovery time for both behaviours. Furthermore, exposure to as little as 65% CO2 affected the motor capability of D. melanogaster. These negative effects are due to both a CO2-specific mechanism and an anoxic effect. These results indicate a heretofore unconsidered impact of CO2 anaesthesia on subsequent behavioural tests revealing the importance of monitoring and accounting for CO2 exposure when performing physiological or behavioural studies in insects.","Article Type - Empirical Primary,Carbon Dioxide,Fly,Fruit Fly,General Anesthetics",https://europepmc.org/articles/PMC4609961
Hedgehog Signaling Regulates Nociceptive Sensitization,"Babcock, Daniel T.; Shi, Shanping; Jo, Juyeon; Shaw, Michael; Gutstein, Howard B.; Galko, Michael J.",2011,"Background Nociceptive sensitization is a tissue damage response whereby sensory neurons near damaged tissue enhance their responsiveness to external stimuli. This sensitization manifests as allodynia (aversive withdrawal to previously nonnoxious stimuli) and/or hyperalgesia (exaggerated responsiveness to noxious stimuli). Although some factors mediating nociceptive sensitization are known, inadequacies of current analgesic drugs have prompted a search for additional targets. Results Here we use a Drosophila model of thermal nociceptive sensitization to show that Hedgehog (Hh) signaling is required for both thermal allodynia and hyperalgesia following ultraviolet irradiation (UV)-induced tissue damage. Sensitization does not appear to result from developmental changes in the differentiation or arborization of nociceptive sensory neurons. Genetic analysis shows that Hh signaling acts in parallel to tumor necrosis factor (TNF) signaling to mediate allodynia and that distinct transient receptor potential (TRP) channels mediate allodynia and hyperalgesia downstream of these pathways. We also demonstrate a role for Hh in analgesic signaling in mammals. Intrathecal or peripheral administration of cyclopamine (CP), a specific inhibitor of Sonic Hedgehog signaling, blocked the development of analgesic tolerance to morphine (MS) or morphine antinociception in standard assays of inflammatory pain in rats and synergistically augmented and sustained morphine analgesia in assays of neuropathic pain. Conclusions We demonstrate a novel physiological role for Hh signaling, which has not previously been implicated in nociception. Our results also identify new potential therapeutic targets for pain treatment.","Article Type - Empirical Primary,Fly,Fruit Fly,Nociception,Pain",https://www.sciencedirect.com/science/article/pii/S0960982211008967
Halothane Resistance in Drosophila melanogaster: Development of a Model and Gene Localization Techniques,"Dapkus, Dave; Ramirez, Sidney; Murray, Michael J.",1996,"Studying genetically altered animals that are resistant to inhaled anesthetics may ultimately lead to an understanding of anesthetics' mechanism(s) of action.We studied the genetics of halothane resistance in a strain of Drosophila melanogaster that showed substantially increased resistance to halothane anesthesia. We developed a test method that allowed us to repeatedly observe several samples of flies exposed to the same concentration of halothane, and we measured halothane resistance. The 50% effective dose (ED50) of 91R flies (our resistant population) was greater than the ED50 of Canton-S (our control strain) by 69% in females and by 48% in males. By assessing the contributions of the three major chromosomes of Drosophila to resistance, this study found that the X and third chromosomes of 91R have no effect on resistance, while the second chromosome has a major impact. Resistance within the second chromosome was further localized by testing marked recombinant chromosomes. The central region of 91R's second chromosome, bounded by the genes for black thoracic color and cinnabar eye color, determined most if not all of the increase in resistance. We were not able to further localize resistance within this segment of the second chromosome (containing about 8% of the total genetic map distance). An autosomal dominant gene for halothane resistance in 91R was localized to a small region of the second chromosome.           (Anesth Analg 1996;83:147-55)","Article Type - Empirical Primary,Fly,Fruit Fly,General Anesthetics",https://journals.lww.com/anesthesia-analgesia/Fulltext/1996/07000/Halothane_Resistance_in_Drosophila_melanogaster_.26.aspx?casa_token=MZZB9jBZA60AAAAA:herYrE9FmqoEzqAt_HvVodqXcElys3Msx4fSMF6_0B8YuRsdxcZwFOwrfIpbwUqor0kTlxyrMB-5uVMH6wojOkB6
Fruit flies for anti-pain drug discovery,"Manev, Hari; Dimitrijevic, Nikola",2005,"Recent work has indicated that fruit flies (Drosophila melanogaster) can be used in nociception research. Genetic screening identified a gene, painless, that is required for thermal and mechanical nociception in Drosophila larvae. On the other hand, parmacological techniques and noxious heat were used to assay antinocieceptive behavior in intact adult Drosophila. In general, animal models for pain research are bound by ethical concerns. Since no serious ethical controversies have been raised regarding experiments in insects, Drosophila may be, for the time being an ethically acceptable animal model for combined genetic and pharmacological analgesia research.","Article Type - Opinion,Fly,Fruit Fly",https://www.sciencedirect.com/science/article/pii/S0024320505000391
Freon-12 anesthesia in two insect species.,"Sinclair, E. R.; Osborn, A. W.",1970,"In tests in New South Wales, complete immobility, with satisfactory subsequent recovery, of fifth-instar nymphs of Perkinsiella saccharicida Kirk, was obtained with 3-hr, exposure to 30 and 40% mixtures of Freon-12 (dichlorodifluoromethane) and air and of adults of Drosophila melanogaster Mg. with 1-3 hr. exposure to 45% mixtures. Recovery after exposure was rapid.","Article Type - Empirical Primary,Fly,Fruit Fly,General Anesthetics,Juvenile,Planthopper",https://www.cabdirect.org/cabdirect/abstract/19710501737
Effects of carbon dioxide anaesthesia on Drosophila melanogaster,"Perron, J. M.; Huot, L.; Corrivault, G. -W.; Chawla, S. S.",1972,"Carbon dioxide anaesthesia produces significant high mortality in 0- to 3-hr-old flies. Young females are more sensitive to 15 min CO2 treatment than the males. Reduced fecundity is observed in flies that recovered from CO2 exposures. However, no effect was observed in Drosophila flies that are older than 3 hr. Similarly carbon dioxide does not affect the fertility of the females as percentage of hatching is the same in both the exposed and control flies.","Article Type - Empirical Primary,Carbon Dioxide,Fly,Fruit Fly,General Anesthetics,Juvenile",https://www.sciencedirect.com/science/article/pii/0022191072901576
Effect of Oseltamivir on hyperalgesia induced by low concentrations of morphine and morphine tolerance in Drosophila melanogaster,"Fereydoni, Masoud; Eskandari, Maliheh; Moghimi, Ali",2014,"Introduction: Morphine has been known as a drug with different paradoxical effects, analgesic and hyperalgesic. On the other hand, repeated morphine administration, induces morphine tolerance in mammals. The aim of recent study is investigating tolerance to morphine in Drosophila melanogaster and the effect of Oseltamivir (an inhibitor of G2 receptors) on hyperalgesia induced by low concentrations of morphine and morphine tolerance. Materials and methods: In this study, stage 3 of larvae and adult state of wild Drosophila melanogaster were used. For evaluating the effect of Oseltamivir on hyperalgesic effect of low concentration Morphine, Oseltamivir (0.2 mg/l) and low concentrations of morphine were added to media culture. Then behavior of larvae and adults to thermal (using Hot plate, 47˚C) and chemical (capsaicin and acetic acid) pain stimulations were recorded. For morphine tolerance experiments in larvae, repeated morphine administration (0.1 and 0.01 mg/l) was done and their response to thermal pain was evaluated. The same method was used in adults but with other doses of morphine (200 and 300 mg/l). Finally to investigate the mechanism of morphine tolerance, Oseltamivir was administered too. Results: morphine tolerance was occurred in Drosophila melanogaster similar to mammals. Repeated morphine administration diminished anti nociceptive effects of morphine (p","Analgesic,Article Type - Empirical Primary,Fly,Fruit Fly,Juvenile,Nociception",https://jsums.medsab.ac.ir/article_355.html
