Title,Authors,Publication Year,Summary,Topics,DOI
Collecting insects to conserve them: a call for ethical caution,"Fischer, Bob; Larson, Brendon M. H.",2019,"Insect sampling for the purpose of measuring biodiversity – as well as entomological research more generally – largely assumes that insects lack consciousness. Here, we briefly present some arguments that insects are conscious and encourage entomologists to revisit their ethical codes in light of them. Specifically, we adapt the Three Rs, guidelines proposed in 1959 by WMS Russell and RL Burch that have become the dominant way of thinking about the ethics of using animals in research. The Three Rs specify the need to replace, reduce, and refine the use of animals in research, yet have received little attention in entomological circles, which is perhaps unsurprising given that Russell and Burch explicitly excluded invertebrates from their purview. As a specific case, we consider issues of suffering and bycatch in the use of Malaise traps for insect sampling. While we do not claim that entomologists have an obligation to adopt the Three Rs framework wholesale, we do suggest that there is reason to adopt it in a modified form to mitigate moral risk especially in the context of conservation.","Article Type - Review,Conservation,Moral Status,Policy,Sentience,Welfare",https://onlinelibrary.wiley.com/doi/abs/10.1111/icad.12344
"Fish sentience, consciousness, and AI","Porcher, Ila France",2018,,"Article Type - Commentary,Fish,Moral Status,Sentience",https://www.wellbeingintlstudiesrepository.org/animsent/vol3/iss21/4
Towards a Comparative Study of Animal Consciousness,"Veit, Walter",2022,"In order to develop a true biological science of consciousness, we have to remove humans from the center of reference and develop a bottom-up comparative study of animal minds, as Donald Griffin intended with his call for a “cognitive ethology.” In this article, I make use of the pathological complexity thesis (Veit 2022a, b, c) to show that we can firmly ground a comparative study of animal consciousness by drawing on the resources of state-based behavioral life history theory. By comparing the different life histories of gastropods and arthropods, we will be able to make better sense of the possible origins of consciousness and its function for organisms in their natural environments.","Article Type - Theoretical Primary,Evolution,Gastropod,Invertebrate,Moral Status",https://doi.org/10.1007/s13752-022-00409-x
Feel or perspective?,"Rowlands, Mark",2016,,"Article Type - Commentary,Sentience",https://www.wellbeingintlstudiesrepository.org/animsent/vol1/iss9/9
"Sentience, Pain and Anesthesia in Advanced Invertebrates. E-book. Lausanne: Frontiers Media. doi: 10.3389/978-2-88963-145-2","Winlow, William; Di Cosmo, Anna",2019,"Sentience may be thought of as the ability to perceive events in the context of previous or future events, resulting in conscious non-reﬂex behavioral modiﬁcation(s) and is dependent on self-awareness. The ability to perceive pain, not just nociceptive stimuli, is thus a consequence of self-awareness, which then imparts the ability to avoid potentially damaging and painful future encounters. Thus, sentience must encompass elements of both time and complexity, including learning and memory, and is dependent upon individual experiences, but at what evolutionarily convergent points in the evolution of nervous systems does the subjective sensation of pain arise. If advanced invertebrates are conscious, sentient and self-aware, then there must be numerous diﬀerent neural systems with which consciousness is associated, so what sort of neural matrix is required for a creature to become sentient?","Anaesthetic,Article Type - Book Chapter,Invertebrate,Pain,Sentience,Welfare",
Decapod sentience: Promising framework and evidence,"Mallatt, Jon; Feinberg, Todd",2022,,"Article Type - Commentary,Decapod,Sentience",https://www.wellbeingintlstudiesrepository.org/animsent/vol7/iss32/24
"Consciousness as integrated perception, motivation, cognition, and action","Shanahan, Murray",2016,,"Affective States,Article Type - Commentary,Invertebrate,Moral Status,Sentience",https://www.wellbeingintlstudiesrepository.org/animsent/vol1/iss9/12
Do Humans Dream of Disappearing Insects?: Fictional Strategies to Convey the Impact of Insect Loss,"Schotland, Sara",2022,"This chapter explores the use of fictional representations to convey urgency about the impact of disappearing insect populations. Philip K. Dick’s iconic Do Androids Dream of Electric Sheep? offers a powerful case that empathy is an essential attribute of humanity. However, it is difficult for most of us to experience the same empathy for insects that we feel for other animals. Insects are perceived as invasive, carriers of disease, and destructive of property; they are less “cute” and companionable. What fictional strategies can be employed to engage a public who, in Donna Haraway’s phrase, are “dithering” over the loss of insects? Strategies would include stories where humans experience the pain of loss of insects, not only emotional loss but deprivation of plant sources needed to feed animals and ultimately human populations.","Article Type - Book Chapter,Conservation,Policy,Welfare",https://doi.org/10.1007/978-3-031-11020-7_10
Edible insects – defining knowledge gaps in biological and ethical considerations of entomophagy,"Pali-Schöll, Isabella; Binder, Regina; Moens, Yves; Polesny, Friedrich; Monsó, Susana",2019,"While seeking novel food sources to feed the increasing population of the globe, several alternatives have been discussed, including algae, fungi or in vitro meat. The increasingly propagated usage of farmed insects for human nutrition raises issues regarding food safety, consumer information and animal protection. In line with law, insects like any other animals must not be reared or manipulated in a way that inflicts unnecessary pain, distress or harm on them. Currently, there is a great need for research in the area of insect welfare, especially regarding species-specific needs, health, farming systems and humane methods of killing. Recent results from neurophysiological, neuroanatomical and behavioral sciences prompt caution when denying consciousness and therefore the likelihood of presence of pain and suffering or something closely related to it to insects. From an animal protection point of view, these issues should be satisfyingly solved before propagating and establishing intensive husbandry systems for insects as a new type of mini-livestock factory farming.","Article Type - Review,Behavior,Farming,Pain,Policy,Sentience",https://doi.org/10.1080/10408398.2018.1468731
Wouldn’t hurt a fly? A review of insect cognition and sentience in relation to their use as food and feed,"Lambert, Helen; Elwin, Angie; D’Cruze, Neil",2021,"Globally, there is increasing pressure to find solutions for feeding the growing human population. One of the proposed answers to this problem is to farm edible insects, both for human consumption and as feed for domesticated livestock. But what do we know about these miniature livestock? Are they capable of suffering, and if so, what does this mean for this new and growing industry? Here, we review a fraction of what is currently known about insect sentience and cognition, by focusing on a portion of the published scientific literature over the past 31 years (1990–2020). Specifically, our review aimed to (1) assess the extent to which insect sentience and cognition featured in a selection of the scientific literature published between 1990 and 2020, (2) assess which aspects have been studied, and in which insect taxa, and (3) identify the insect species currently being promoted in policy for farming, and the reasons why edible insects are now on the global policy agenda. We found evidence that many species of insects, across a broad range of taxonomic Orders, are assumed and/or confirmed to be capable of a range of cognitive abilities, and that there is reason to believe that some species may also feel important emotional states such as stress. The market for insects as feed and food is set to become a booming industry in the future, yet our review highlights how we still know very little about the minds of insects and their capacity to suffer in farming systems. We hope that our findings will stimulate additional research and subsequent policy development relating to how insects are farmed in the future, particularly in the context of mitigating any potential negative animal welfare impacts.","Article Type - Review,Farming,Food/feed,Policy",https://www.sciencedirect.com/science/article/pii/S0168159121002197
"Science, sentience, and animal welfare","Jones, Robert C.",2013,"I sketch briefly some of the more influential theories concerned with the moral status of nonhuman animals, highlighting their biological/physiological aspects. I then survey the most prominent empirical research on the physiological and cognitive capacities of nonhuman animals, focusing primarily on sentience, but looking also at a few other morally relevant capacities such as self-awareness, memory, and mindreading. Lastly, I discuss two examples of current animal welfare policy, namely, animals used in industrialized food production and in scientific research. I argue that even the most progressive current welfare policies lag behind, are ignorant of, or arbitrarily disregard the science on sentience and cognition.","Article Type - Review,Food/feed,Policy,Welfare",https://doi.org/10.1007/s10539-012-9351-1
Animal sentience,"Browning, Heather; Birch, Jonathan",2022,"‘Sentience’ sometimes refers to the capacity for any type of subjective experience, and sometimes to the capacity to have subjective experiences with a positive or negative valence, such as pain or pleasure. We review recent controversies regarding sentience in fish and invertebrates and consider the deep methodological challenge posed by these cases. We then present two ways of responding to the challenge. In a policy-making context, precautionary thinking can help us treat animals appropriately despite continuing uncertainty about their sentience. In a scientific context, we can draw inspiration from the science of human consciousness to disentangle conscious and unconscious perception (especially vision) in animals. Developing better ways to disentangle conscious and unconscious affect is a key priority for future research.","Article Type - Theoretical Primary,Pain,Policy,Sentience",https://onlinelibrary.wiley.com/doi/abs/10.1111/phc3.12822
Nociceptive Biology of Molluscs and Arthropods: Evolutionary Clues About Functions and Mechanisms Potentially Related to Pain,"Walters, Edgar T.",2018,"Important insights into the selection pressures and core molecular modules contributing to the evolution of pain-related processes have come from studies of nociceptive systems in several molluscan and arthropod species. These phyla, and the chordates that include humans, last shared a common ancestor approximately 550 million years ago. Since then, animals in these phyla have continued to be subject to traumatic injury, often from predators, which has led to similar adaptive behaviors (e.g., withdrawal, escape, recuperative behavior) and physiological responses to injury in each group. Comparisons across these taxa provide clues about the contributions of convergent evolution and of conservation of ancient adaptive mechanisms to general nociceptive and pain-related functions. Primary nociceptors have been investigated extensively in a few molluscan and arthropod species, with studies of long-lasting nociceptive sensitization in the gastropod, Aplysia, and the insect, Drosophila, being especially fruitful. In Aplysia, nociceptive sensitization has been investigated as a model for aversive memory and for hyperalgesia. Neuromodulator-induced, activity-dependent, and axotomy-induced plasticity mechanisms have been defined in synapses, cell bodies, and axons of Aplysia primary nociceptors. Studies of nociceptive sensitization in Drosophila larvae have revealed numerous molecular contributors in primary nociceptors and interacting cells. Interestingly, molecular contributors examined thus far in Aplysia and Drosophila are largely different, but both sets overlap extensively with those in mammalian pain-related pathways. In contrast to results from Aplysia and Drosophila, nociceptive sensitization examined in moth larvae (Manduca) disclosed central hyperactivity but no obvious peripheral sensitization of nociceptive responses. Squid (Doryteuthis) show injury-induced sensitization manifested as behavioral hypersensitivity to tactile and especially visual stimuli, and as hypersensitivity and spontaneous activity in nociceptor terminals. Temporary blockade of nociceptor activity during injury subsequently increased mortality when injured squid were exposed to fish predators, providing the first demonstration in any animal of the adaptiveness of nociceptive sensitization. Immediate responses to noxious stimulation and nociceptive sensitization have also been examined behaviorally and physiologically in a snail (Helix), octopus (Adopus), crayfish (Astacus), hermit crab (Pagurus), and shore crab (Hemigrapsus). Molluscs and arthropods have systems that suppress nociceptive responses, but whether opioid systems play antinociceptive roles in these phyla is uncertain.","Article Type - Review,Evolution,Nociception",https://www.frontiersin.org/articles/10.3389/fphys.2018.01049
The evolutionary history of consciousness,"Søvik, Eirik; Perry, Clint J.",2016,"Klein & Barron argue that insects are capable of subjective experience, i.e., sentience. Whereas we mostly agree with the conclusion of their arguments, we think there is an even more important message to be learned from their work. The line of reasoning opened by Klein & Barron proves instructive for how neuroscientists can and should explore the biological phenomenon of consciousness.","Article Type - Commentary,Evolution,Sentience",https://bravo.hivolda.no/hivolda-xmlui/handle/11250/3040955
Minds without spines: Evolutionarily inclusive animal ethics.,"Mikhalevich, Irina; Powell, Russell",2020,,"Article Type - Review,Evolution,Invertebrate,Moral Status,Sentience",https://scholarworks.rit.edu/article/1993
Sentience in evolutionary context,"Mallatt, Jon; Feinberg, Todd",2020,,"Article Type - Commentary,Evolution,Sentience",https://www.wellbeingintlstudiesrepository.org/animsent/vol5/iss29/14
Convergent evolution of sentience?,"Brown, Culum",2020,,"Article Type - Commentary,Evolution,Fish,Sentience",https://www.wellbeingintlstudiesrepository.org/animsent/vol5/iss29/25
Informing policy and practice on insect pollinator declines: Tensions between conservation and animal welfare,"Barrett, Meghan; Fischer, Bob; Buchmann, Stephen",2023,"Climate change, agricultural intensification, and other anthropogenic ecosystem challenges have caused declines in the diversity and abundance of insect pollinators. In response to these declines, entomologists have called for greater attention to insect pollinator conservation. Conservation primarily aims to protect groups of non-human animals—populations or species—with only secondary concern for the welfare of individual animals. While conservation and animal welfare goals are sometimes aligned, they often are not. And because animal welfare comes second, it tends to be sacrificed when in tension with conversation priorities. Consider, for example, lethal sampling to monitor many pollinator populations. Growing evidence suggests that the welfare of individual insect pollinators may be morally significant, particularly in the Hymenoptera and Diptera. Considering insect welfare in conservation practices and policies presents many challenges as, in the face of rapid, anthropogenic change, it may be impossible to avoid harming individual animals while promoting diverse populations. We suggest some practical, implementable strategies that can allow for more robust integration of animal welfare goals into insect pollinator conservation. By following these strategies, entomologists may be able to find policies and practices that promote the health of ecosystems and the individual animals within them.","Article Type - Opinion,Conservation,Policy,Welfare",https://www.frontiersin.org/articles/10.3389/fevo.2022.1071251
Is it pain if it does not hurt? On the unlikelihood of insect pain,"Adamo, S.",2019,"Whether insects (Insecta) have the subjective experience of pain is difficult to answer. Recent work in humans demonstrated that the experience of pain occurs due to the activation of a “pain network” that integrates nociceptive sensory information, memory, emotion, cognition, and self-awareness. In humans, the processing of nociceptive sensory information alone does not produce the subjective experience of pain. Insect nociception is processed largely in parallel in two higher-order areas in the brain: the mushroom bodies and the central complex. There is little evidence of a coordinated pain network that would integrate these two areas with each other along with other traits thought to be important for a pain experience in humans. However, it is difficult to exclude the possibility that insects could have a modest pain experience using a less integrated neural circuit. This possibility seems unlikely, however, because even a modest experience would require some neuronal investment. It is unclear whether insects would benefit from such an investment. Recent work in artificial intelligence suggests that relatively simple, cost-efficient circuits can produce adaptive behaviours without subjective experience. Given our current understanding of insect behaviour, neurobiology, and evolution, the likelihood that insects experience pain is low.","Article Type - Perspective,Behavior,Evolution,Pain,Sentience",https://www.cambridge.org/core/journals/canadian-entomologist/article/is-it-pain-if-it-does-not-hurt-on-the-unlikelihood-of-insect-pain/9A60617352A45B15E25307F85FF2E8F2
To bee or not to bee?,"Edelman, Shimon; Moyal, Roy; Fekete, Tomer",2016,,"Affective States,Article Type - Commentary,Bee,Moral Status,Sentience",https://www.wellbeingintlstudiesrepository.org/animsent/vol1/iss9/14
"What it’s like, or not like, to Bee","Abbate, Cheryl",2022,,"Article Type - Opinion,Bee,Evolution,Moral Status,Sentience",https://digitalcommons.calpoly.edu/bts/vol26/iss1/1
Variation in North American bumble bee nest success and colony sizes under captive rearing conditions,"Strange, James P; Tripodi, Amber D; Lindsay, Thuy-Tien T; Herndon, James D; Knoblett, Joyce; Christman, Morgan E; Barkan, N Pinar; Koch, Jonathan B U",2023,"Of the 265 known bumble bee (Bombus) species, knowledge of colony lifecycle is derived from relatively few species. As interest in Bombus commercialization and conservation grows, it is becoming increasingly important to understand colony growth dynamics across a variety of species since variation exists in nest success, colony growth, and reproductive output. In this study, we reported successful nest initiation and establishment rates of colonies and generated a timeline of colony development for 15 western North American Bombus species, which were captively reared from wild-caught gynes from 2009 to 2019. Additionally, we assessed variation in colony size among 5 western North American Bombus species from 2015 to 2018. Nest initiation and establishment rates varied greatly among species, ranging from 5–76.1% and 0–54.6%, respectively. Bombus griseocollis had the highest rates of nest success across the 11-yr period, followed by B. occidentalis, B. vosnesenskii, and B. huntii. Furthermore, days to nest initiation and days to nest establishment varied among species, ranging from 8.4 to 27.7 days and 32.7 to 47 days. Colony size also differed significantly among species with B. huntii and B. vosnesenskii producing more worker/drone cells than B. griseocollis, B. occidentalis, and B. vancouverensis. Additionally, gyne production differed significantly among species with B. huntii colonies producing more gynes than B. vosnesenskii. Results from this study increase knowledge of systematic nesting biology for numerous western North American Bombus species under captive rearing conditions, which can further improve rearing techniques available to conservationists and researchers.","Article Type - Empirical Primary,Bee,Bumble Bee,Captivity,Rearing,Research Use",https://doi.org/10.1093/jisesa/iead032
Do bumble bees play?,"Galpayage Dona, Hiruni Samadi; Solvi, Cwyn; Kowalewska, Amelia; Mäkelä, Kaarle; MaBouDi, HaDi; Chittka, Lars",2022,"A variety of animals have been found to interact with and manipulate inanimate objects ‘just for fun’, that is, to play. Most clear examples of object play come from mammals and birds. However, whether insects interact with inanimate objects as a form of play has never been systematically examined. Here, we show that rolling of wooden balls by bumble bees, Bombus terrestris, fulfils behavioural criteria for animal play and is akin to play in other animals. We found that ball rolling (1) did not contribute to immediate survival strategies, (2) was intrinsically rewarding, (3) differed from functional behaviour in form, (4) was repeated but not stereotyped, and (5) was initiated under stress-free conditions. Through the design of the experiment and with the support of behavioural observations, we excluded the possibilities that ball rolling was driven by exploration for food, clutter clearing or mating. Similar to vertebrate play, we also found age and sex differences for ball rolling by bumble bees: younger bees rolled more balls than older bees and male bees rolled individual balls for longer durations than females. We explicitly show that ball rolling is itself a rewarding activity. After being trained to find freely movable balls in one of two differently coloured chambers, bees showed a preference for the colour of the chamber where they had rolled balls. Our results contribute to the question of sentience in insects and lend further support for the existence of positive affective states in these animals.","Affective States,Article Type - Empirical Primary,Bee,Behavior,Bumble Bee",https://www.sciencedirect.com/science/article/pii/S0003347222002366
Using local anaesthetics to block neuronal activity and map specific learning tasks to the mushroom bodies of an insect brain,"Devaud, Jean-Marc; Blunk, Aline; Podufall, Jasmin; Giurfa, Martin; Grünewald, Bernd",2007,"The formation of a stable olfactory memory requires activity within several brain regions. The honeybee provides a valuable model to map complex olfactory learning tasks onto certain brain areas. To this end, we used injections of the local anaesthetic procaine to reversibly block spike activity in a specific brain region, the mushroom body (MB). We first investigated the physiological effects of procaine on cultured MB neurons from adult honeybee brains. Using the whole-cell configuration of the patch-clamp technique, we show that procaine blocks voltage-gated Na+ and K+ currents in a dose-dependent manner between 0.1 and 10 mm. The effects are reversible within a few minutes of wash. Lidocaine acts similarly, but is less effective at the tested concentrations. We then studied the role of the MBs during reversal learning by blocking the neural activity within these structures by injecting procaine. During reversal learning bees learn to revert their responses to two odorants, one rewarded (A+) and one unrewarded (B–), if their contingencies are changed (A– vs B+). Injecting procaine into the MBs impaired reversal learning. Procaine treatment during acquisition left the later retention of the initial learning (A+ vs B–) intact. Similarly, a differential conditioning task involving novel odorants (C+ vs D–) was intact under procaine treatment. Our experiments show that local injections of procaine can be used to map learning tasks onto specific regions of the insect brain. We conclude that intact MB activity is required for the acquisition of reversal learning, but not for simple differential learning tasks.","Bee,Honey Bee,Local Anesthetic",https://onlinelibrary.wiley.com/doi/abs/10.1111/j.1460-9568.2007.05904.x
